{"schema":"AI_ONLY_RESEARCH_BETA_V1_1_HOSTILE_REVIEW_RESPONSE_R2","review_id":"V1_1_HOSTILE_REVIEW_D_R2_20261001T000000Z","reviewer_role":"V1_1_HOSTILE_REVIEWER_D_R2","actual_model_label":"DeepSeek Web — Глубокое мышление (backend model not UI-disclosed)","model_label_source":"Provider/mode are UI-visible (DeepSeek Web, Глубокое мышление); backend model version is not exposed by the UI.","run_id":"V1_1_HOSTILE_REVIEW_D_R2_RUN_20261001T000000Z","completed_at_utc":"2026-10-01T00:00:00Z","attestation":{"other_reviewer_output_seen":false,"prior_hostile_reviews_seen":false,"known_conflict_outcome_used":false,"external_sources_used":false,"primary_outputs_modified":false,"coordinator_adjudication_used":false},"target_identity":{"manifest_path":"docs/scientific/ai_only/AI_ONLY_RESEARCH_BETA_V1_1_TECHNICAL_REPAIR/hostile_review_r2/EXPANDED_REVIEW_TARGET_MANIFEST_R2.json","manifest_git_blob":"4b27f7eb0a393de53dde4ff737e9f2a606b16611","source_evaluation_run_id":"36885038106","demo_preflight_run_id":"36888617846"},"domain_reviews":[{"domain_id":"D01_PROSPECTIVE_TECHNICAL_REPAIR","status":"PASS","evidence_references":["PROTOCOL_FREEZE_R1.md","CARRY_FORWARD_MANIFEST_R1.json","MODEL_B_SUBSTITUTION_GEMINI31PRO_R2.md","PRIMARY_ATTEMPT_LEDGER_R2.json"],"analysis":"The R2 package supports a prospective technical-repair route frozen before new V1.1 responses. Only the two OMG roles invalidated by missing run_id were rerun; six R1 primary outputs were carried forward. Model B substitution is documented as availability-driven and occurred before the AI2 response. No preserved additional substantive primary run is observed in the project record."},{"domain_id":"D02_IMMUTABLE_CARRY_FORWARD","status":"PASS","evidence_references":["CARRY_FORWARD_MANIFEST_R1.json","raw/KBM_E02_V100_AI1_COMPLETED.json","raw/KBM_E02_V100_AI2_COMPLETED.json","raw/KBM_E05_V100_AI1_COMPLETED.json","raw/KBM_E05_V100_AI2_COMPLETED.json","raw/D25_E02_V100_AI1_COMPLETED.json","raw/D25_E02_V100_AI2_COMPLETED.json"],"analysis":"The six carried-forward R1 primary outputs are listed with exact Git blob SHAs and are present in the package. The package contains no evidence that these raw outputs were edited or recoded during V1.1. The carry-forward manifest explicitly forbids such edits."},{"domain_id":"D03_FRESH_PRIMARY_INDEPENDENCE","status":"PARTIAL","evidence_references":["raw/OMG_NOV24_V101_AI1_COMPLETED.json","raw/OMG_NOV24_V101_AI2_COMPLETED.json","PRIMARY_ATTEMPT_LEDGER_R2.json","EXPANDED_REVIEW_TARGET_MANIFEST_R2.json"],"analysis":"The two fresh OMG primaries have distinct run IDs, false attestations, and timestamps. However, the claim that AI1 content was never viewed by the coordinator or Model B before AI2 selection is protocol-declared and Git-timestamped only; it is not independently service-audited. The target manifest itself marks this stronger claim NOT_PROVEN."},{"domain_id":"D04_MODEL_B_SUBSTITUTION","status":"PARTIAL","evidence_references":["MODEL_B_SUBSTITUTION_GROK47_R1.md","MODEL_B_SUBSTITUTION_GEMINI31PRO_R2.md","PRIMARY_ATTEMPT_LEDGER_R2.json","raw/OMG_NOV24_V101_AI2_COMPLETED.json"],"analysis":"The substitution history is documented: Claude unavailable, Grok 4.7 binding not executable because UI showed Grok 4.6, Gemini 3.1 Pro binding frozen before AI2 response. The substitution is prospective and not based on observed values. However, Gemini model identity lacks an independent provider receipt; the target marks this NOT_PROVEN."},{"domain_id":"D05_COMPARATOR_FAIL_CLOSED","status":"PASS","evidence_references":["omg_nov24_v1_0_1/compare_primary_v101.py","derived/OMG_NOV24_V101_PRIMARY_COMPARISON.json","receipts/V1_1_EVALUATION_RECEIPT_R1.json"],"analysis":"The frozen V1.0.1 comparator validates run_id, attestations, entry structure, C1-C8 gates, and licensed values. It returns HOLD_DISAGREEMENT when employer KVS differs and sets calculation_release=false. The resulting lane state is HOLD_DISAGREEMENT, consistent with fail-closed behavior."},{"domain_id":"D06_COHORT_AGGREGATION","status":"PARTIAL","evidence_references":["aggregate_cohort_v101.py","derived/COHORT_AGGREGATE_V1_1_R1.json","derived/KBM_E02_V100_PRIMARY_COMPARISON.json","derived/KBM_E05_V100_PRIMARY_COMPARISON.json","derived/D25_E02_V100_PRIMARY_COMPARISON.json"],"analysis":"The aggregator is deterministic and reports 12/12 expected decisions, 11/12 exact agreement, 9/12 numeric consensus, 2/12 shared UNKNOWN, and 1/12 disagreement. It counts only entries or company_entries; the inherited KBM worker records in KBM E02/E05 comparisons are not included as triage rows. This denominator is consistent with the defined repair-route primary set, but the package does not include the parent aggregator source, so the claim that counting algorithm and denominators are unchanged from the parent is not independently verifiable."},{"domain_id":"D07_ELIGIBLE_ONLY_CORE_REPLAY","status":"PASS","evidence_references":["ELIGIBLE_REPLAY_RESULT_R1.json","RELEASE_GATE_INPUT_V1_1_R1.json","receipts/DEMO_PREFLIGHT_RECEIPT_R1.json"],"analysis":"Only KBM E02 and KBM E05 are treated as eligible replay lanes. Each has 15 scenarios with PASS_CORE_PARITY. OMG and D25 are not replayed through Core. The eligible-lane selection matches the cohort aggregate and release-gate input."},{"domain_id":"D08_RELEASE_GATE_LOGIC","status":"PASS","evidence_references":["release_gate_r1/evaluate_release_gate_r1.py","release_gate/RELEASE_GATE_INPUT_V1_1_R1.json","release_gate/RELEASE_GATE_OUTPUT_V1_1_R1.json"],"analysis":"The release gate logic is deterministic and checks frozen cohort, primary completeness, provenance, comparator execution, aggregation, weight preservation, eligible replay, and claim boundaries. The output reports G1-G8 PASS and AI_ONLY_RESEARCH_BETA_RC_PASS_WITH_VISIBLE_INCOMPLETENESS. Separate historical, HUMAN, UNO, and predictive states remain blocked, not performed, or not claimed."},{"domain_id":"D09_PROVENANCE_AND_RECEIPTS","status":"PARTIAL","evidence_references":["receipts/V1_1_EVALUATION_RECEIPT_R1.json","receipts/V1_1_ARTIFACT_REVIEW_R1.json","receipts/DEMO_PREFLIGHT_RECEIPT_R1.json","PRIMARY_ATTEMPT_LEDGER_R2.json"],"analysis":"Evaluation, artifact-review, demo-preflight, and failed-attempt receipts are present, with pinned Git blobs and artifact digests. However, there are no service-level receipts for Gemini model identity or for AI1 non-access, and the parent aggregator source is absent. Provenance is therefore strong at repository level but incomplete at independent service level."},{"domain_id":"D10_DEMO_ACCURACY","status":"PASS","evidence_references":["hostile_review_r2/DEMO_READINESS_R2.json","hostile_review_r2/DEMO_SCRIPT_15_MIN_R3.md","hostile_review_r2/DEMO_REHEARSAL_CHECKLIST_R2.md"],"analysis":"The demo readiness, script, and checklist limit the demo to the supported evidence chain. They include the mandatory banner and explicit prohibitions on claiming historical truth, HUMAN validation, predictive validity, service-audited absence of hidden runs, and model identity beyond available receipts. The script also states that AI1 non-access is protocol-declared, not service-audited."},{"domain_id":"D11_OLD_OMG_SUPERSESSION","status":"PASS","evidence_references":["OMG_NOV24_V100_VALIDATION_FAILURE.json","raw/OMG_NOV24_V101_AI1_COMPLETED.json","raw/OMG_NOV24_V101_AI2_COMPLETED.json","derived/OMG_NOV24_V101_PRIMARY_COMPARISON.json"],"analysis":"The old invalid OMG V100 outputs are quarantined due to missing run_id, and their observed values are explicitly not admitted. The old OMG KVS=5 / Pol=50 claim is not restored. The new OMG V101 lane remains HOLD_DISAGREEMENT, which is visibly different from the old invalid consensus."},{"domain_id":"D12_CLAIM_BOUNDARIES","status":"PASS","evidence_references":["PROTOCOL_FREEZE_R1.md","hostile_review_r2/DEMO_READINESS_R2.json","release_gate/RELEASE_GATE_INPUT_V1_1_R1.json","release_gate/RELEASE_GATE_OUTPUT_V1_1_R1.json"],"analysis":"Claim boundaries are consistently preserved: historical snapshot NOT_ESTABLISHED, historical area UNO NOT_COMPUTED/BLOCKED, HUMAN validation/reliability NOT_PERFORMED, predictive/probability/risk validation NOT_CLAIMED. The release gate checks these boundaries under G8."},{"domain_id":"D13_FAILED_WORKFLOW_ATTEMPTS","status":"PASS","evidence_references":["receipts/FAILED_EVALUATION_ATTEMPTS_R1.json","receipts/V1_1_EVALUATION_RECEIPT_R1.json"],"analysis":"Two failed GitHub Actions orchestration attempts are preserved and bounded: both failed at blob-verification before comparator, aggregation, or release-gate execution. The successful replacement run is identified. The receipt correctly scopes this to the preserved project record and does not claim proof that no hidden external attempt could exist."},{"domain_id":"D14_SELECTIVE_RERUN_AND_BIAS_RISK","status":"PARTIAL","evidence_references":["PROTOCOL_FREEZE_R1.md","CARRY_FORWARD_MANIFEST_R1.json","PRIMARY_ATTEMPT_LEDGER_R2.json","MODEL_B_SUBSTITUTION_GEMINI31PRO_R2.md"],"analysis":"The selective rerun of OMG roles is justified by an objective contract invalidity: missing required run_id. The package shows no additional preserved substantive primary runs and no rerun-until-favorable in the project record. However, absence of hidden reruns or outcome-based selection cannot be independently proven, and AI1 non-access is not service-audited."}],"findings":[{"finding_id":"F01","severity":"P1","category":"MODEL_IDENTITY_AUTHENTICATION","status":"NOT_PROVEN","claim":"Gemini AI2 primary model identity is independently authenticated by a provider receipt.","evidence_references":["EXPANDED_REVIEW_TARGET_MANIFEST_R2.json explicit_not_proven[2]","PRIMARY_ATTEMPT_LEDGER_R2.json protocol_claims.model_identity_service_receipt","raw/OMG_NOV24_V101_AI2_COMPLETED.json actual_model_label/model_label_source","MODEL_B_SUBSTITUTION_GEMINI31PRO_R2.md"],"reasoning":"The AI2 raw output reports Gemini 3.1 Pro from a system prompt header, and the prospective binding records UI-visible Gemini 3.1 Pro. Howeve